{
  "benchmark_id": "tool-selection-core-example",
  "version": "1.0.0",
  "family": "tool-selection",
  "status": "frozen",
  "scenario_path": "evals/scenarios/tool-selection",
  "task_specs_path": "evals/datasets/tool-selection/tool-selection-core.task-specs.json",
  "split_policy": ["dev", "held-out", "stress", "ablation"],
  "success_metric": "route_accuracy",
  "failure_classes": [
    "route_mismatch",
    "command_failed",
    "artifact_missing",
    "checkpoint_blocked"
  ],
  "judge_type": "programmatic",
  "judge_version": "programmatic-router-judge-v1",
  "judge_path": "evals/judges/programmatic-router-judge.json",
  "contamination_risk": "low",
  "publication_status": "public-draft",
  "claim_links": [
    "docs/reference/architecture/system-overview.md",
    "docs/how-to/choose-an-execution-model.md",
    "docs/reference/cli/umbrella.md"
  ],
  "regression_policy": {
    "baseline_results": {
      "dev": "evals/results/baselines/tool-selection-core-dev.json",
      "held-out": "evals/results/baselines/tool-selection-core-held-out.json"
    },
    "minimum_metrics": {
      "success_rate": 1.0,
      "route_accuracy": 1.0,
      "artifact_completeness": 1.0,
      "checkpoint_compliance": 1.0
    },
    "max_negative_delta": 0.0
  },
  "release_gate": {
    "required_splits": ["dev", "held-out"],
    "block_on_pending_checkpoints": true,
    "required_claim_links": [
      "docs/reference/architecture/system-overview.md",
      "docs/how-to/choose-an-execution-model.md"
    ]
  },
  "notes": "Example benchmark card mirroring the tool-selection-core family."
}
