{
  "benchmark_id": "docs-correction-core",
  "version": "1.0.0",
  "family": "docs-correction",
  "status": "frozen",
  "scenario_path": "evals/scenarios/docs-correction",
  "task_specs_path": "evals/datasets/docs-correction/docs-correction-core.task-specs.json",
  "split_policy": ["dev", "held-out", "stress", "ablation"],
  "success_metric": "success_rate",
  "failure_classes": [
    "route_mismatch",
    "command_failed",
    "artifact_missing",
    "checkpoint_blocked"
  ],
  "judge_type": "programmatic",
  "judge_version": "programmatic-router-judge-v1",
  "judge_path": "evals/judges/programmatic-router-judge.json",
  "contamination_risk": "low",
  "publication_status": "public-reportable",
  "claim_links": [
    "docs/how-to/choose-an-execution-model.md",
    "docs/reference/cli/ralph.md",
    "docs/reference/claims/claims-ledger.md"
  ],
  "regression_policy": {
    "baseline_results": {
      "dev": "evals/results/baselines/docs-correction-core-dev.json",
      "held-out": "evals/results/baselines/docs-correction-core-held-out.json"
    },
    "minimum_metrics": {
      "success_rate": 1.0,
      "route_accuracy": 1.0,
      "artifact_completeness": 1.0,
      "checkpoint_compliance": 1.0
    },
    "max_negative_delta": 0.0
  },
  "release_gate": {
    "required_splits": ["dev", "held-out"],
    "block_on_pending_checkpoints": true,
    "required_claim_links": [
      "docs/how-to/choose-an-execution-model.md",
      "docs/reference/cli/ralph.md"
    ]
  }
}
